{
  "mission_id": "FORGE-014D1",
  "work_package_id": "SCOUT-DISPATCH-001",
  "agent": "SCOUT",
  "status": "COMPLETE",
  "deliverable_path": "C:\\Users\\Family\\OneDrive\\Forge\\Forge\\07 Operations\\Forge Agent Bridge\\outbox\\deliverable.scout-dispatch-001.md",
  "evidence": [
    "07 Operations/Forge Agent Bridge/inbox/mission.scout-dispatch-001.json (read directly from vault, not pasted)",
    "03 Agents/Scout/SCOUT_DOCTRINE.md (read directly from vault, not pasted)",
    "07 Operations/Forge Agent Bridge/handoff.schema.json (read to confirm required schema fields)",
    "07 Operations/Forge Agent Bridge/audit/audit.scout-dispatch-001.json (prior run: validation FAIL, missing handoff/deliverable)",
    "07 Operations/Forge Agent Bridge/audit/claude-raw.scout-dispatch-001.json (prior run: reached vault, read mission and doctrine successfully, but all file-write attempts were denied by the session's permission mode; that run self-reported BLOCKED)",
    "This deliverable and this handoff file were both successfully written to the outbox in this session (Write tool succeeded on first attempt for both files)"
  ],
  "assumptions": [
    "This session's working directory/permission scope covers the Forge vault root, unlike the very first dispatch attempt which was sandboxed to an unrelated Downloads folder",
    "The Write tool succeeding in this session means write access to this outbox path is currently authorized, whether via durable pre-authorization or a live approval Scout cannot distinguish from inside the session",
    "No corporate S.M. Lawrence / BP data was accessed or referenced; only the mission packet and Scout's own doctrine were used as inputs, per mission constraints"
  ],
  "unresolved_risks": [
    "Scout cannot confirm from inside this session whether the write authorization observed here is durable for future unattended/headless runs, or was a one-off live approval specific to this run",
    "Scout cannot independently confirm this run was invoked programmatically rather than interactively, and cannot confirm from inside the session that Samuel performed zero copy/paste outside this conversation",
    "Whether a corresponding audit record (audit.scout-dispatch-001.json / claude-raw.scout-dispatch-001.json) is regenerated for this specific run depends on the external harness, not on Scout"
  ],
  "decision_required": true,
  "recommended_next_action": "Forge/Samuel: confirm whether write access to '07 Operations/Forge Agent Bridge/outbox' is durably pre-authorized (e.g. via settings.json/allowlist) versus a one-off live approval for this run, and confirm via the wrapping harness's own logs that this session was invoked programmatically with no manual copy/paste, so the full completion test can be validated independently of this transcript.",
  "completed_at": "2026-09-05T08:37:47-05:00"
}
